{
  "contractVersion": 1,
  "correlation": {
    "requestId": "req-0001",
    "userId": "user-0001"
  },
  "toolCallId": "call-0001",
  "status": "success",
  "payload": {
    "accepted": true,
    "rendered": false,
    "fallback": "cited_text",
    "reason": "No Phase 4 presentation component is registered yet; continue describing these records in cited text."
  },
  "sensitivity": { "sensitive": false, "confirmationRequired": false }
}
